<?xml version="1.0" encoding="UTF-8" standalone="yes"?>
<lionengine:transitions xmlns:lionengine="http://lionengine.b3dgs.com/xsd/10" xmlns:xsi="http://www.w3.org/2001/XMLSchema-instance" xsi:schemaLocation="http://lionengine.b3dgs.com/xsd/10 http://lionengine.b3dgs.com/xsd/10/game/feature/tile/map/transition/tileTransitions.xsd">
    <lionengine:transition in="fog" out="none" type="UP">
        <lionengine:tile number="0"/>
    </lionengine:transition>
    <lionengine:transition in="fog" out="none" type="DOWN">
        <lionengine:tile number="1"/>
    </lionengine:transition>
    <lionengine:transition in="fog" out="none" type="RIGHT">
        <lionengine:tile number="2"/>
    </lionengine:transition>
    <lionengine:transition in="fog" out="none" type="LEFT">
        <lionengine:tile number="3"/>
    </lionengine:transition>
    <lionengine:transition in="fog" out="none" type="CORNER_UP_LEFT">
        <lionengine:tile number="7"/>
    </lionengine:transition>
    <lionengine:transition in="fog" out="none" type="CORNER_UP_RIGHT">
        <lionengine:tile number="6"/>
    </lionengine:transition>
    <lionengine:transition in="fog" out="none" type="CORNER_DOWN_LEFT">
        <lionengine:tile number="5"/>
    </lionengine:transition>
    <lionengine:transition in="fog" out="none" type="CORNER_DOWN_RIGHT">
        <lionengine:tile number="4"/>
    </lionengine:transition>
    <lionengine:transition in="fog" out="none" type="UP_LEFT">
        <lionengine:tile number="8"/>
    </lionengine:transition>
    <lionengine:transition in="fog" out="none" type="UP_RIGHT">
        <lionengine:tile number="9"/>
    </lionengine:transition>
    <lionengine:transition in="fog" out="none" type="DOWN_LEFT">
        <lionengine:tile number="10"/>
    </lionengine:transition>
    <lionengine:transition in="fog" out="none" type="DOWN_RIGHT">
        <lionengine:tile number="11"/>
    </lionengine:transition>
    <lionengine:transition in="fog" out="none" type="UP_LEFT_DOWN_RIGHT">
        <lionengine:tile number="13"/>
    </lionengine:transition>
    <lionengine:transition in="fog" out="none" type="UP_RIGHT_DOWN_LEFT">
        <lionengine:tile number="12"/>
    </lionengine:transition>
    <lionengine:transition in="none" out="fog" type="DOWN">
        <lionengine:tile number="0"/>
    </lionengine:transition>
    <lionengine:transition in="none" out="fog" type="UP">
        <lionengine:tile number="1"/>
    </lionengine:transition>
    <lionengine:transition in="none" out="fog" type="LEFT">
        <lionengine:tile number="2"/>
    </lionengine:transition>
    <lionengine:transition in="none" out="fog" type="RIGHT">
        <lionengine:tile number="3"/>
    </lionengine:transition>
    <lionengine:transition in="none" out="fog" type="UP_LEFT">
        <lionengine:tile number="7"/>
    </lionengine:transition>
    <lionengine:transition in="none" out="fog" type="UP_RIGHT">
        <lionengine:tile number="6"/>
    </lionengine:transition>
    <lionengine:transition in="none" out="fog" type="DOWN_LEFT">
        <lionengine:tile number="5"/>
    </lionengine:transition>
    <lionengine:transition in="none" out="fog" type="DOWN_RIGHT">
        <lionengine:tile number="4"/>
    </lionengine:transition>
    <lionengine:transition in="none" out="fog" type="CORNER_UP_LEFT">
        <lionengine:tile number="8"/>
    </lionengine:transition>
    <lionengine:transition in="none" out="fog" type="CORNER_UP_RIGHT">
        <lionengine:tile number="9"/>
    </lionengine:transition>
    <lionengine:transition in="none" out="fog" type="CORNER_DOWN_LEFT">
        <lionengine:tile number="10"/>
    </lionengine:transition>
    <lionengine:transition in="none" out="fog" type="CORNER_DOWN_RIGHT">
        <lionengine:tile number="11"/>
    </lionengine:transition>
    <lionengine:transition in="none" out="fog" type="UP_RIGHT_DOWN_LEFT">
        <lionengine:tile number="13"/>
    </lionengine:transition>
    <lionengine:transition in="none" out="fog" type="UP_LEFT_DOWN_RIGHT">
        <lionengine:tile number="12"/>
    </lionengine:transition>
    <lionengine:transition in="none" out="none" type="CENTER">
        <lionengine:tile number="17"/>
    </lionengine:transition>
    <lionengine:transition in="fog" out="fog" type="CENTER">
        <lionengine:tile number="16"/>
    </lionengine:transition>
</lionengine:transitions>